{
  "note": {
    "id": "n_01J9X5F7Y8Z9K1M2N3P4Q5R6S7",
    "client_id": "8f1c2b3a-4d5e-6f7a-8b9c-0d1e2f3a4b5c",
    "status": "done",
    "name": "This week",
    "text": "sql quiz monday 9am, email the group tonight, fyi lab moved to room 3",
    "source_file_name": null,
    "written_at": "2026-10-23T08:12:00+07:00",
    "processed_at": "2026-10-23T08:12:01+07:00",
    "engine": "rules"
  },
  "changes": [
    {
      "kind": "created",
      "label": "Mon 26 Oct · 09:00 · SQL Course",
      "task": {
        "id": "t_01J9X5G1A2B3C4D5E6F7G8H9J0",
        "title": "SQL quiz",
        "due_date": "2026-10-26",
        "start_time": "09:00",
        "end_time": null,
        "priority": "high",
        "project_id": "p_sql_course",
        "repeat": "never",
        "reminder": "1d",
        "done": false,
        "notes": null
      }
    },
    {
      "kind": "created",
      "label": "Today · 20:00",
      "task": {
        "id": "t_01J9X5G2A2B3C4D5E6F7G8H9J1",
        "title": "Email the group",
        "due_date": "2026-10-23",
        "start_time": "20:00",
        "end_time": null,
        "priority": "medium",
        "project_id": null,
        "repeat": "never",
        "reminder": "15m",
        "done": false,
        "notes": null
      }
    }
  ],
  "plan": null,
  "skipped": [
    {
      "ref": "s1",
      "text": "fyi lab moved to room 3",
      "reason": "skip"
    }
  ],
  "ambiguous": []
}
