{
  "note": {
    "id": "n_01J9X5F7Y8Z9K1M2N3P4Q5R6S9",
    "client_id": "0b1c2d3e-4f5a-6b7c-8d9e-0f1a2b3c4d5e",
    "status": "followup",
    "name": "Idea: dark mode for portfolio site",
    "text": "idea: dark mode for portfolio site",
    "source_file_name": null,
    "written_at": "2026-10-23T08:12:00+07:00",
    "processed_at": "2026-10-23T08:12:01+07:00",
    "engine": "rules"
  },
  "changes": [],
  "plan": null,
  "skipped": [
    {
      "ref": "s1",
      "text": "idea: dark mode for portfolio site",
      "reason": "skip"
    }
  ],
  "ambiguous": []
}
