{
  "note": {
    "id": "019a1c00-0000-7000-8000-000000000302",
    "client_id": "6f1c2b3a-4d5e-4f7a-8b9c-0d1e2f3a4b02",
    "status": "confirm",
    "name": "Update: Old reading list",
    "text": "delete old reading list, done email prof",
    "source_file_name": null,
    "written_at": "2026-10-23T08:12:00+07:00",
    "processed_at": "2026-10-23T08:12:01+07:00",
    "engine": "rules"
  },
  "changes": [],
  "plan": {
    "create": [],
    "update": [
      {
        "ref": "u1",
        "task_id": "019a1c00-0000-7000-8000-000000000203",
        "label": "Completed",
        "done": true
      }
    ],
    "delete": [
      {
        "ref": "d1",
        "task_id": "019a1c00-0000-7000-8000-000000000205",
        "label": "Old reading list"
      }
    ]
  },
  "skipped": [],
  "ambiguous": [
    {
      "ref": "u1",
      "candidates": [
        "019a1c00-0000-7000-8000-000000000203",
        "019a1c00-0000-7000-8000-000000000204"
      ],
      "preselected": "019a1c00-0000-7000-8000-000000000203"
    }
  ]
}
